{
  "intent": {
    "title": "Self-check successful",
    "summary": "Maintainer self-check completed with all systems nominal.",
    "priority": "P0"
  },
  "package_contract": {
    "artifact_manifest": "self_check_manifest_v1.yaml",
    "notes": "No new artifacts generated during self-check."
  },
  "risks": [],
  "next_actions": [
    {
      "action": "Monitor system health",
      "owner": "Maintainer"
    }
  ]
}